{
  "liturgical_date": "2026-04-06",
  "title": "Renungan contoh",
  "body": "Paragraf singkat renungan harian dalam Bahasa Indonesia. Ini hanya contoh untuk validasi skema; ganti dengan konten yang telah ditinjau teologis.",
  "byline": "Tim redaksi (contoh)",
  "language": "id",
  "ai_assisted": true,
  "human_reviewed": true,
  "published_at": "2026-04-05T18:00:00+07:00",
  "source_attribution": "Catholic Daily App — saluran editorial internal (contoh)"
}
