{
  "liturgical_date": "2026-04-06",
  "title": "Berjalan Dalam Terang Kebangkitan",
  "body": "Di tengah kesibukan dan ketidakpastian hidup, Tuhan mengundang kita untuk kembali menaruh harapan pada-Nya. Kebangkitan Kristus bukan hanya peristiwa masa lalu, melainkan sumber kekuatan yang terus bekerja hari ini. Saat kita memilih mengampuni, melayani, dan tetap setia dalam hal-hal kecil, terang Kristus dinyatakan melalui hidup kita.\n\nMari memulai hari ini dengan hati yang tenang: menyerahkan kekhawatiran kepada Tuhan, lalu melangkah dengan kasih kepada sesama. Semoga melalui kata-kata, sikap, dan keputusan kita, orang lain dapat merasakan damai yang datang dari Kristus yang hidup.",
  "byline": "Tim Editorial Catholic Daily App",
  "language": "id",
  "ai_assisted": true,
  "human_reviewed": false,
  "published_at": "2026-04-06T07:00:00+07:00",
  "source_attribution": "Catholic Daily App — editorial internal"
}
